{
  "task": "f11-new-product-404",
  "branch": "fix/day16-new-product-404",
  "pr": {
    "number": 47,
    "url": "https://github.com/ivanprotsko/upready-store/pull/47"
  },
  "done": [
    {
      "item": "Найдены и устранены две независимые поломки: панель сохраняла кириллический handle, а витрина не декодировала percent-encoded сегмент URL перед поиском товара."
    },
    {
      "item": "В панели идентификатор товара и категории теперь транслитерируется из названия (ГОСТ-образец), включая создание и редактирование."
    },
    {
      "item": "На витрине добавлен decodeSegment/decodeSegments и применён в пяти роутах (товары, категории, коллекции, журнал, страницы), канонические ссылки и JSON-LD по-прежнему строятся по сырому сегменту."
    },
    {
      "item": "Добавлен тест-близнец slugify.ts панели и импортёра бэкенда, синхронизирующий транслитерацию между двумя приложениями."
    },
    {
      "item": "Приёмка на живом магазине cherkashino.shipshift.dev: три товара с русскими названиями заведены через мастер панели владелицей и открываются на витрине с кодом 200, контрольный импортированный товар не сломан."
    },
    {
      "item": "Живые скриншоты каталога и всех четырёх страниц товара сохранены как артефакты приёмки, PR #47 смёржен."
    }
  ],
  "results": [
    {
      "label": "PR #47 (смёржен)",
      "url": "https://github.com/ivanprotsko/upready-store/pull/47"
    },
    {
      "label": "Отчёт воркера",
      "path": "file:///Users/ivanprotsko/upready/projects/upready-store/artifacts/docs/f11-new-product-404/report.md"
    },
    {
      "label": "Отчёт приёмки",
      "path": "file:///Users/ivanprotsko/upready/projects/upready-store/handoff/day-2026-09-16-oksana-store/artifacts/accept-f11-new-product-404-1/REPORT.md"
    },
    {
      "label": "Скриншот живого каталога",
      "path": "file:///Users/ivanprotsko/upready/projects/upready-store/handoff/day-2026-09-16-oksana-store/artifacts/accept-f11-new-product-404-1/live-catalog-1280x900.png"
    }
  ],
  "notes": [
    "Составлен штабом задним числом (sonnet) по PR и журналу приёмки; воркер задачи отчёта не писал.",
    "Цена в мастере создания товара не выставляется (дефект f09, не этой задачи) — для приёмки цены проставлены отдельно через API.",
    "Уникальность handle между разными магазинами (IDX_product_handle_unique) этой задачей не решена.",
    "Три тестовых товара приёмки остались опубликованными в живом каталоге Оксаны, их нужно удалить."
  ]
}
