{
  "task": "r02-handover",
  "done": [
    {
      "item": "Собрана сводка для Ивана: адреса магазина и их коды (200), живой sha на хосте, список из 16 PR за день, что не доехало и что не перенесено, четыре развилки, которые решает только Иван."
    },
    {
      "item": "Подготовлен пронумерованный список из 7 пунктов для Оксаны простым языком: название магазина, реквизиты, рабочий e-mail, подтверждение личности для доменов, боевые данные Robokassa, токен Wildberries, данные для входа через Яндекс ID."
    },
    {
      "item": "В сводке для Ивана зафиксирован живой замер d03 (14:25 WITA): 5 адресов платформы отвечают 200, домены cherkashino.ru и черкашино.рф не открываются — DNS ещё на регистраторе."
    },
    {
      "item": "Отдельно выделено, что смёржено, но не задеплоено (#45, #46), и что задеплоено, но не перенесены данные Оксаны (отзывы, блог, характеристики, реквизиты, редиректы — везде 0 строк на хосте)."
    }
  ],
  "results": [
    {
      "label": "Сводка для Ивана",
      "path": "/Users/ivanprotsko/upready/projects/upready-store/handoff/day-2026-09-16-oksana-store/artifacts/r02-handover/for-ivan.md"
    },
    {
      "label": "Текст сообщения Оксане",
      "path": "/Users/ivanprotsko/upready/projects/upready-store/handoff/day-2026-09-16-oksana-store/artifacts/r02-handover/for-oksana.md"
    },
    {
      "label": "Живой магазин Оксаны",
      "url": "https://cherkashino.shipshift.dev/ru"
    }
  ],
  "notes": [
    "Составлен штабом задним числом (sonnet) по PR и журналу приёмки; воркер задачи отчёта не писал.",
    "Развилка не закрыта: название магазина «Олавка» или «Черкашино» — Оксана не отвечает с 2026-09-14 (#469371).",
    "301-редиректы одобрены приёмкой, но на живом хосте таблица tenant_redirect пуста — скрипт импорта прогнан только на стенде."
  ]
}
