{
  "task": "d03-deploy-mt-3",
  "done": [
    {
      "item": "На живой хост выкачен финальный образ дня (2286d43): mt-backend, mt-storefront и mt-panel пересобраны и подняты, откатная точка wave2 сохранена нетронутой."
    },
    {
      "item": "Перед подъёмом контейнеров проверен модуль sharp в новом образе (require(\"sharp\") → sharp OK 0.35.4), это устранило проблему прошлой неудачной попытки."
    },
    {
      "item": "Применена миграция Migration20260915063900 (таблица tenant_requisites из PR #32 t12-legal-requisites), остальные модули — без изменений схемы."
    },
    {
      "item": "Финальный health-свип: 5 из 5 платформенных URL и 5 из 5 карточек товара магазина Оксаны отдают HTTP 200."
    },
    {
      "item": "Подтверждено, что отвечает именно новый код: маршрут /tenants/branding/upload из t16 отдаёт 401 (требует авторизации), а не 404, как было бы на старом образе."
    },
    {
      "item": "Каталог тенанта cherkashino проверен на неизменность данных: 29 опубликованных товаров из 38, как и в x01/d02."
    },
    {
      "item": "В отчёт записан список смёрженных за день задач: 13 PR по UTC-суткам (16 по рабочему дню WITA)."
    },
    {
      "item": "Зафиксирован риск №15 «Эксплуатация»: медиа тенанта cherkashino (117 МБ, 338 файлов) лежат на одном хосте без S3 и без автоматических бэкапов."
    }
  ],
  "results": [
    {
      "label": "Отчёт по деплою (report.md)",
      "path": "artifacts/d03-deploy-mt-3/report.md"
    },
    {
      "label": "Список смёрженных за день PR",
      "path": "artifacts/d03-deploy-mt-3/merged-prs.json"
    },
    {
      "label": "Health-свип платформенных URL",
      "path": "artifacts/d03-deploy-mt-3/health-platform.txt"
    },
    {
      "label": "Health-свип карточек товара",
      "path": "artifacts/d03-deploy-mt-3/health-products.txt"
    },
    {
      "label": "Витрина клиента (живой стенд)",
      "url": "https://cherkashino.shipshift.dev/ru"
    }
  ],
  "notes": [
    "Составлен штабом задним числом (sonnet) по PR и журналу приёмки; воркер задачи отчёта не писал.",
    "Риск №15: медиа тенантов на МТ хранятся без S3 и без автоматических бэкапов — pg_dump спасает БД, но не файлы картинок."
  ]
}
